Unnamed: 0,Sector,CourseName,Duration,Minimum Education,Language,Module,TopicName,URL
929,Aerospace Engineering,Spacecraft Design,,12th,English/Hindi,Module 65: Star Citizen Bubble Lights Design,【60代の妄想3DCG】コスモシーガル・100式空間偵察機 発艦,https://www.youtube.com/watch?v=L7jOXAjXGnw
930,Aerospace Engineering,Spacecraft Design,,12th,English/Hindi,Module 65: Star Citizen Bubble Lights Design,Is the Constellation Series Finally Good? (Star Citizen),https://www.youtube.com/watch?v=4WzkNNTWXHI
931,Aerospace Engineering,Spacecraft Design,,12th,English/Hindi,Module 66: Citroen AMI EV Design,Testing out my new clang fueled piston gun - Space Engineers,https://www.youtube.com/watch?v=MTe22deZS3A
932,Aerospace Engineering,Spacecraft Design,,12th,English/Hindi,Module 66: Citroen AMI EV Design,Learning to walk on Digilegs,https://www.youtube.com/watch?v=cwknVRcpYH4
933,Aerospace Engineering,Spacecraft Design,,12th,English/Hindi,Module 67: Tesla Valve Design and Applications,大友克洋『武器よさらば』MV,https://www.youtube.com/watch?v=AnwR2XF_Lsk
934,Aerospace Engineering,Spacecraft Design,,12th,English/Hindi,Module 67: Tesla Valve Design and Applications,An Architect Reviews the Starlifter - Star Citizen,https://www.youtube.com/watch?v=4K8OK-owwcg
935,Aerospace Engineering,Spacecraft Design,,12th,English/Hindi,Module 68: Star Citizen Carrack Ship Review,Risking My Life To Settle A Physics Debate,https://www.youtube.com/watch?v=jyQwgBAaBag
936,Aerospace Engineering,Spacecraft Design,,12th,English/Hindi,Module 68: Star Citizen Carrack Ship Review,An Architect Reviews the Mercury Star Runner [Star Citizen],https://www.youtube.com/watch?v=LLTFq8M-Tt8
937,Aerospace Engineering,Spacecraft Design,,12th,English/Hindi,Module 69: Lego Technic Void Wheel Concept,Origin 135c First Look & Tour | Star Citizen Ships,https://www.youtube.com/watch?v=-xPAhppERck
938,Aerospace Engineering,Spacecraft Design,,12th,English/Hindi,Module 69: Lego Technic Void Wheel Concept,Star Citizen Mercury Star Runner Tour - It's Finally Here!,https://www.youtube.com/watch?v=CqWpTqknRkU
939,Aerospace Engineering,Spacecraft Design,,12th,English/Hindi,Module 70: Gundam Model Design,Finland Might Have Solved Nuclear Power’s Biggest Problem,https://www.youtube.com/watch?v=kYpiK3W-g_0
940,Aerospace Engineering,Spacecraft Design,,12th,English/Hindi,Module 70: Gundam Model Design,Star Citizen » Mustang Beta V2,https://www.youtube.com/watch?v=Kqo-iI6G68w
941,Aerospace Engineering,Spacecraft Design,,12th,English/Hindi,Module 71: Star Trek Discovery Upgrade Design,Starship Size Comparison 2021,https://www.youtube.com/watch?v=KAQp_5aZerw
942,Aerospace Engineering,Spacecraft Design,,12th,English/Hindi,Module 71: Star Trek Discovery Upgrade Design,Star Citizen: Should you buy the San'Tok.Yai?,https://www.youtube.com/watch?v=f0qrJnv3kjs
943,Aerospace Engineering,Spacecraft Design,,12th,English/Hindi,Module 72: Star Citizen Constellation Series Review,How Jetoptera's Bladeless Propulsion System Works,https://www.youtube.com/watch?v=Z8ARFa7HE3c
944,Aerospace Engineering,Spacecraft Design,,12th,English/Hindi,Module 72: Star Citizen Constellation Series Review,Tank Boat Antasena Sukses Jalani Sea Trial & Firing Test,https://www.youtube.com/watch?v=fv89Ntw3i04
945,Aerospace Engineering,Spacecraft Design,,12th,English/Hindi,Module 73:  Star Citizen Mercury Star Runner Review,Ascend is a wearable robot designed to end knee pain,https://www.youtube.com/watch?v=Khz5fQDGFtI
946,Aerospace Engineering,Spacecraft Design,,12th,English/Hindi,Module 73:  Star Citizen Mercury Star Runner Review,Plane Sets ITSELF On FIRE! - Stormworks Search and Destroy- Weapons DLC,https://www.youtube.com/watch?v=J9q4rzgsvng
947,Aerospace Engineering,Spacecraft Design,,12th,English/Hindi,Module 74: Star Citizen San'Tok.Yai Ship Review,How Boston Dynamics Is Building Its Robot Empire,https://www.youtube.com/watch?v=SZRAGpo3wy0
948,Aerospace Engineering,Spacecraft Design,,12th,English/Hindi,Module 74: Star Citizen San'Tok.Yai Ship Review,Zeelander Z55 - Mood Video,https://www.youtube.com/watch?v=0n0FbzLJm5A
949,Aerospace Engineering,Spacecraft Design,,12th,English/Hindi,Module 75: Jetoptera Bladeless Propulsion System,This is the finest car in the world! FACT!,https://www.youtube.com/watch?v=Bu0UhBrzd8k
950,Aerospace Engineering,Spacecraft Design,,12th,English/Hindi,Module 75: Jetoptera Bladeless Propulsion System,The Rolls Royce Boat Tail: The Worlds Most Expensive DUD or Masterfully Restrained?,https://www.youtube.com/watch?v=ZP5x5GnhKSY
951,Aerospace Engineering,Spacecraft Design,,12th,English/Hindi,Module 76:  Tank Boat Antasena Design,We Asked a Sword Expert to Make a Realistic Lightsaber Fight,https://www.youtube.com/watch?v=hp-D-488Yxk
952,Aerospace Engineering,Spacecraft Design,,12th,English/Hindi,Module 76:  Tank Boat Antasena Design,Combat Mech & Self Targeting Artillery Gun - Search & Destroy Weapons DLC - Stormworks,https://www.youtube.com/watch?v=G3S1yBQX7KA
953,Aerospace Engineering,Spacecraft Design,,12th,English/Hindi,Module 77: Boston Dynamics Robot Design,5 reasons why the HENRY LONG RANGER is the BEST LEVER GUN EVER! (.223/5.56 lever action rifle?),https://www.youtube.com/watch?v=wsCO0XV5rwA
