S.No.,Sector,CourseName,Duration,Minimum Education,Language,Module,TopicName,URL
1,Special Education,Learning disabilities,5hrs 20min,12th,English/Hindi,Module 1: Introduction to Learning Disabilities,What does learning disability really mean?,https://www.youtube.com/watch?v=3yvZYyeWE20
2,Special Education,Learning disabilities,,12th,English/Hindi,Module 1: Introduction to Learning Disabilities,Learning disability awareness: what you need to know about learning disability,https://www.youtube.com/watch?v=BoGTBcVHnd0
3,Special Education,Learning disabilities,,12th,English/Hindi,Module 1: Introduction to Learning Disabilities,Communication: speaking to people with a learning disability,https://www.youtube.com/watch?v=IyV1v-nib38
4,Special Education,Learning disabilities,,12th,English/Hindi,Module 2: Understanding Specific Learning Disabilities,Profound intellectual and multiple disabilities | NHS,https://www.youtube.com/watch?v=0MAsTRaR404
5,Special Education,Learning disabilities,,12th,English/Hindi,Module 2: Understanding Specific Learning Disabilities,What do we mean by severe learning disabilities?,https://www.youtube.com/watch?v=cINUCiN2PAw
6,Special Education,Learning disabilities,,12th,English/Hindi,Module 2: Understanding Specific Learning Disabilities,What Are Learning Disabilities?,https://www.youtube.com/watch?v=vQZ9HusISiY
7,Special Education,Learning disabilities,,12th,English/Hindi,Module 3: Communication and Respect,What is a learning disability? Mencap Young Ambassadors tackle stereotypes,https://www.youtube.com/watch?v=N5I877T7RZs
8,Special Education,Learning disabilities,,12th,English/Hindi,Module 3: Communication and Respect,Respect for Learning Disabilities,https://www.youtube.com/watch?v=GME_GqAy7M0
9,Special Education,Learning disabilities,,12th,English/Hindi,Module 3: Communication and Respect,What is a learning disability?,https://www.youtube.com/watch?v=9Tls8PyUVKc
